{
  "$comment": "GENERATED by contracts/codegen/generate.py from capture_stack.schema.yaml - DO NOT EDIT.",
  "$schema": "https://json-schema.org/draft/2020-12/schema",
  "additionalProperties": true,
  "description": "A registered capture-stack version, referenced by id from each episode \u2014 CONTRACT \u00a73.1, B-9.",
  "properties": {
    "camera_fw": {
      "description": "Camera firmware version.",
      "type": "string"
    },
    "camera_model": {
      "description": "Camera model.",
      "type": "string"
    },
    "capture_stack_id": {
      "description": "The capture-stack identity (the anchor; referenced from the episode).",
      "minLength": 1,
      "type": "string"
    },
    "coordinator_sw": {
      "description": "Coordinator/Eunomia software version (discardd).",
      "type": "string"
    },
    "fob_board": {
      "description": "Fob board type.",
      "type": "string"
    },
    "fob_fw": {
      "description": "Fob firmware version.",
      "type": "string"
    },
    "gripper_hw": {
      "description": "UMI gripper hardware version.",
      "type": [
        "string",
        "null"
      ]
    },
    "modality": {
      "description": "Capture modality (domain-closed hard enum; umi today, teleop slots in with no schema break).",
      "enum": [
        "umi",
        "teleop"
      ],
      "type": "string"
    },
    "schema": {
      "description": "Schema identifier; additive semver (\u00a75).",
      "enum": [
        "eunomia-capture-stack/v1"
      ],
      "type": "string"
    },
    "sd_model": {
      "description": "SD card model.",
      "type": [
        "string",
        "null"
      ]
    },
    "version": {
      "description": "Stack version (a firmware/hw change is a new version; resolvable as-of, B-8).",
      "type": "integer"
    }
  },
  "required": [
    "schema",
    "capture_stack_id"
  ],
  "title": "CaptureStack",
  "type": "object"
}
